{
  "controls": [
    {
      "assessment": "partial",
      "control_id": "DSCB-L1-REQ-001",
      "evidence_refs": [
        "source/junit.xml",
        "runtime/junit.xml",
        "repository/quality/traceability.json"
      ],
      "observation": "57 Tests bestanden; 5 technische Anforderungszuordnungen geprüft.",
      "remaining": "Freigegebene Systemanforderungen und vollständige Abdeckung aller Komponenten nachweisen.",
      "title": "Anforderungen, Tests und Berichte",
      "tools": [
        "pytest",
        "JUnit"
      ]
    },
    {
      "assessment": "partial",
      "control_id": "DSCB-L1-REQ-002",
      "evidence_refs": [
        "platform/commit.json",
        "platform/pulls.json"
      ],
      "observation": "Commit und identifizierbarer Autor bestätigt.",
      "remaining": "Organisatorische VCS-Freigabe und benötigte Review-Nachweise separat belegen; kein unabhängiges Review abgeleitet.",
      "title": "Änderungen und Autoren",
      "tools": [
        "GitHub API"
      ]
    },
    {
      "assessment": "gap",
      "control_id": "DSCB-L1-REQ-003",
      "evidence_refs": [
        "platform/protection.json",
        "platform/rules.json"
      ],
      "observation": "Branch-Schutz HTTP 403; Branch-Regeln HTTP 200.",
      "remaining": "Vollständige Schutz- und Bypass-Regeln lesen und Direktänderungsverbot bewerten. API-Zugriff allein beweist keinen Schutz.",
      "title": "Geschützte Branches",
      "tools": [
        "GitHub API"
      ]
    },
    {
      "assessment": "findings",
      "control_id": "DSCB-L1-REQ-004",
      "evidence_refs": [
        "source/bandit.json",
        "source/ruff.json"
      ],
      "observation": "4 Bandit- und 134 Ruff-Befunde; erfolgreiche Werkzeugausführung: True.",
      "remaining": "Security-relevante Befunde fachlich bewerten und Entscheidungen dokumentieren.",
      "title": "Sichere Entwicklung",
      "tools": [
        "Bandit",
        "Ruff"
      ]
    },
    {
      "assessment": "partial",
      "control_id": "DSCB-L1-REQ-005",
      "evidence_refs": [
        "image-ha-sync/sbom.cyclonedx.json",
        "image-query-api/sbom.cyclonedx.json",
        "image-semantic-enrichment/sbom.cyclonedx.json",
        "image-world-model-chat/sbom.cyclonedx.json",
        "image-neo4j/sbom.cyclonedx.json"
      ],
      "observation": "749 Komponentenmeldungen in fünf Image-SBOMs (Mehrfachzählungen möglich).",
      "remaining": "Inventar umfasst Runtime-Images; Entwicklungs- und Build-Abhängigkeiten vollständig ergänzen.",
      "title": "Abhängigkeiten erfassen",
      "tools": [
        "Trivy",
        "CycloneDX"
      ]
    },
    {
      "assessment": "measured",
      "control_id": "DSCB-L1-REQ-006",
      "evidence_refs": [
        "image-ha-sync/sbom.cyclonedx.json",
        "image-query-api/sbom.cyclonedx.json",
        "image-semantic-enrichment/sbom.cyclonedx.json",
        "image-world-model-chat/sbom.cyclonedx.json",
        "image-neo4j/sbom.cyclonedx.json",
        "image-ha-sync/subject.json",
        "image-query-api/subject.json",
        "image-semantic-enrichment/subject.json",
        "image-world-model-chat/subject.json",
        "image-neo4j/subject.json"
      ],
      "observation": "Fünf nichtleere SBOMs mit den gescannten Image-IDs abgeglichen.",
      "remaining": "Nachweis gilt für diese CI-Builds; keine Release- oder Deployment-Freigabe.",
      "title": "SBOM je Artefakt",
      "tools": [
        "Trivy",
        "CycloneDX"
      ]
    },
    {
      "assessment": "partial",
      "control_id": "DSCB-L1-REQ-007",
      "evidence_refs": [
        "image-ha-sync/build.execution.json",
        "image-query-api/build.execution.json",
        "image-semantic-enrichment/build.execution.json",
        "image-world-model-chat/build.execution.json",
        "image-neo4j/build.execution.json",
        "image-ha-sync/subject.json",
        "image-query-api/subject.json",
        "image-semantic-enrichment/subject.json",
        "image-world-model-chat/subject.json",
        "image-neo4j/subject.json"
      ],
      "observation": "Erfolgreiche Build-Ausführung und festgelegte Basis-Image-Digests für fünf Images erfasst.",
      "remaining": "Python-Abhängigkeiten sperren und reproduzierbare Wiederholungsbuilds nachweisen.",
      "title": "Kontrollierte Builds",
      "tools": [
        "Docker",
        "GitHub Actions"
      ]
    },
    {
      "assessment": "measured",
      "control_id": "DSCB-L1-REQ-008",
      "evidence_refs": [
        "image-ha-sync/subject.json",
        "image-query-api/subject.json",
        "image-semantic-enrichment/subject.json",
        "image-world-model-chat/subject.json",
        "image-neo4j/subject.json"
      ],
      "observation": "Fünf Image-IDs mit Commit, Scanner- und Docker-Metadaten abgeglichen.",
      "remaining": "Archive-Digests sind Producer-Angaben; vollständige Image-Archive zentral nicht erneut gehasht.",
      "title": "Build-Ergebnisse identifizieren",
      "tools": [
        "Docker",
        "SHA-256"
      ]
    },
    {
      "assessment": "measured",
      "control_id": "DSCB-L1-REQ-009",
      "evidence_refs": [
        "image-ha-sync/vulnerabilities.json",
        "image-query-api/vulnerabilities.json",
        "image-semantic-enrichment/vulnerabilities.json",
        "image-world-model-chat/vulnerabilities.json",
        "image-neo4j/vulnerabilities.json"
      ],
      "observation": "Trivy-JSON und erfolgreiche Scan-Ausführung für alle fünf Image-IDs geprüft.",
      "remaining": "Scan-Abschluss bewertet weder Ausnutzbarkeit noch Risikoakzeptanz.",
      "title": "Schwachstellen scannen",
      "tools": [
        "Trivy"
      ]
    },
    {
      "assessment": "findings",
      "control_id": "DSCB-L1-REQ-010",
      "evidence_refs": [
        "image-ha-sync/vulnerabilities.json",
        "image-query-api/vulnerabilities.json",
        "image-semantic-enrichment/vulnerabilities.json",
        "image-world-model-chat/vulnerabilities.json",
        "image-neo4j/vulnerabilities.json"
      ],
      "observation": "1782 Image-/Paketmeldungen, davon 1 kritisch und 332 hoch.",
      "remaining": "Befunde auf betroffene Nutzung prüfen, beheben oder autorisierte Entscheidungen einholen; keine automatische Risikofreigabe.",
      "title": "Schwachstellen bewerten",
      "tools": [
        "Trivy"
      ]
    },
    {
      "assessment": "partial",
      "control_id": "DSCB-L1-REQ-011",
      "evidence_refs": [
        "image-ha-sync/subject.json",
        "image-query-api/subject.json",
        "image-semantic-enrichment/subject.json",
        "image-world-model-chat/subject.json",
        "image-neo4j/subject.json"
      ],
      "observation": "Ausgewählte Rohdateien gegen laufgebundene Producer-Manifeste geprüft.",
      "remaining": "Zugriffsschutz, Aufbewahrung und unabhängige Provenienz fehlen in dieser Bewertung; keine Signatur- oder Komplettarchivprüfung.",
      "title": "Artefakte vor Manipulation schützen",
      "tools": [
        "SHA-256",
        "GitHub Artifacts"
      ]
    },
    {
      "assessment": "measured",
      "control_id": "DSCB-L1-REQ-012",
      "evidence_refs": [
        "image-ha-sync/subject.json",
        "image-query-api/subject.json",
        "image-semantic-enrichment/subject.json",
        "image-world-model-chat/subject.json",
        "image-neo4j/subject.json"
      ],
      "observation": "Image-IDs und Quell-Commit sind durchgängig zugeordnet.",
      "remaining": "Identität ist keine Aussage über Freigabe oder Vertrauenswürdigkeit des Producers.",
      "title": "Artefaktidentität",
      "tools": [
        "Docker",
        "SHA-256"
      ]
    },
    {
      "assessment": "gap",
      "control_id": "DSCB-L1-REQ-013",
      "evidence_refs": [
        "platform/environments.json"
      ],
      "observation": "Umgebungsabfrage HTTP 200; keine autorisierte Deployment-Freigabe im Messvertrag.",
      "remaining": "Zielumgebung und autorisierte Freigabe für das konkrete Artefakt nachweisen. Merge und grüner Lauf reichen nicht.",
      "title": "Deployment autorisieren",
      "tools": [
        "GitHub API"
      ]
    },
    {
      "assessment": "gap",
      "control_id": "DSCB-L1-REQ-014",
      "evidence_refs": [
        "runtime/deployment.json"
      ],
      "observation": "Query-API und Neo4j wurden mit den gescannten Image-IDs in kurzlebiger CI getestet.",
      "remaining": "Deployment in eine genehmigte Zielumgebung und dortige Auswahl freigegebener Artefakte nachweisen.",
      "title": "Nur freigegebene Artefakte deployen",
      "tools": [
        "Docker",
        "pytest"
      ]
    },
    {
      "assessment": "measured",
      "control_id": "DSCB-L1-REQ-015",
      "evidence_refs": [
        "image-ha-sync/manifest.json",
        "image-neo4j/manifest.json",
        "image-query-api/manifest.json",
        "image-semantic-enrichment/manifest.json",
        "image-world-model-chat/manifest.json",
        "platform/manifest.json",
        "runtime/manifest.json",
        "source/manifest.json"
      ],
      "observation": "Ausgewählte Nachweisdateien an Repository, Commit, Lauf und Versuch gebunden und zentral geprüft.",
      "remaining": "Keine unabhängige Attestation; nicht heruntergeladene Archivbytes bleiben ungeprüft.",
      "title": "Maschinenlesbare Nachweise",
      "tools": [
        "JSON",
        "JUnit",
        "SHA-256"
      ]
    },
    {
      "assessment": "partial",
      "control_id": "DSCB-L1-REQ-016",
      "evidence_refs": [
        "runtime/deployment.json",
        "runtime/junit.xml",
        "runtime/query-api.log",
        "runtime/neo4j.log"
      ],
      "observation": "8 Runtime-Tests bestanden; Image-IDs und CI-Logs erfasst.",
      "remaining": "VM, Betriebsregister und dauerhafte Security-Ereignisaufbewahrung ergänzen; CI ist kein Betriebsnachweis.",
      "title": "Betrieb nachvollziehen",
      "tools": [
        "pytest",
        "HTTP",
        "Neo4j",